{
  "$schema": "http://json-schema.org/draft-04/schema",
  "title": "JSON Schema for my JSON file format",

  "type": "object",

  "required": [
    "AttributeList",
    "VariantList",
    "TypeList",
    "TemplateName"
  ],

  "properties": {
    "AttributeList": {
      "$id": "#/properties/AttributeList",
      "type": "array",
      "title": "The AttributeList schema",
      "description": "An explanation about the purpose of this instance.",
      "default": [],

      "additionalItems": true,
      "items": {
        "$id": "#/properties/AttributeList/items",
        "anyOf": [
          {
            "$id": "#/properties/AttributeList/items/anyOf/0",
            "type": "object",
            "title": "The first anyOf schema",
            "description": "An explanation about the purpose of this instance.",
            "default": {},

            "required": [
              "ID",
              "Name",
              "CostperLevelDesc",
              "Progression",
              "MaxLevel",
              "Stat",
              "Page",
              "Human",
              "Type",
              "Container",
              "CostperLevel",
              "RequiresVariant",
              "SpecialPointsPerLevel",
              "SpecialContainer",
              "EnforceMaxLevel",
              "Description",
              "ChildrenList"
            ],
            "properties": {
              "ID": {
                "$id": "#/properties/AttributeList/items/anyOf/0/properties/ID",
                "type": "integer",
                "title": "The ID schema",
                "description": "An explanation about the purpose of this instance.",
                "default": 0

              },
              "Name": {
                "$id": "#/properties/AttributeList/items/anyOf/0/properties/Name",
                "type": "string",
                "title": "The Name schema",
                "description": "An explanation about the purpose of this instance.",
                "default": ""

              },
              "CostperLevelDesc": {
                "$id": "#/properties/AttributeList/items/anyOf/0/properties/CostperLevelDesc",
                "type": "string",
                "title": "The CostperLevelDesc schema",
                "description": "An explanation about the purpose of this instance.",
                "default": ""

              },
              "Progression": {
                "$id": "#/properties/AttributeList/items/anyOf/0/properties/Progression",
                "type": "string",
                "title": "The Progression schema",
                "description": "An explanation about the purpose of this instance.",
                "default": ""

              },
              "MaxLevel": {
                "$id": "#/properties/AttributeList/items/anyOf/0/properties/MaxLevel",
                "type": "integer",
                "title": "The MaxLevel schema",
                "description": "An explanation about the purpose of this instance.",
                "default": 0

              },
              "Stat": {
                "$id": "#/properties/AttributeList/items/anyOf/0/properties/Stat",
                "type": "string",
                "title": "The Stat schema",
                "description": "An explanation about the purpose of this instance.",
                "default": ""

              },
              "Page": {
                "$id": "#/properties/AttributeList/items/anyOf/0/properties/Page",
                "type": "string",
                "title": "The Page schema",
                "description": "An explanation about the purpose of this instance.",
                "default": ""

              },
              "Human": {
                "$id": "#/properties/AttributeList/items/anyOf/0/properties/Human",
                "type": "boolean",
                "title": "The Human schema",
                "description": "An explanation about the purpose of this instance.",
                "default": false

              },
              "Type": {
                "$id": "#/properties/AttributeList/items/anyOf/0/properties/Type",
                "type": "string",
                "title": "The Type schema",
                "description": "An explanation about the purpose of this instance.",
                "default": ""

              },
              "Container": {
                "$id": "#/properties/AttributeList/items/anyOf/0/properties/Container",
                "type": "boolean",
                "title": "The Container schema",
                "description": "An explanation about the purpose of this instance.",
                "default": false

              },
              "CostperLevel": {
                "$id": "#/properties/AttributeList/items/anyOf/0/properties/CostperLevel",
                "type": "integer",
                "title": "The CostperLevel schema",
                "description": "An explanation about the purpose of this instance.",
                "default": 0

              },
              "RequiresVariant": {
                "$id": "#/properties/AttributeList/items/anyOf/0/properties/RequiresVariant",
                "type": "boolean",
                "title": "The RequiresVariant schema",
                "description": "An explanation about the purpose of this instance.",
                "default": false

              },
              "SpecialPointsPerLevel": {
                "$id": "#/properties/AttributeList/items/anyOf/0/properties/SpecialPointsPerLevel",
                "type": "integer",
                "title": "The SpecialPointsPerLevel schema",
                "description": "An explanation about the purpose of this instance.",
                "default": 0

              },
              "SpecialContainer": {
                "$id": "#/properties/AttributeList/items/anyOf/0/properties/SpecialContainer",
                "type": "boolean",
                "title": "The SpecialContainer schema",
                "description": "An explanation about the purpose of this instance.",
                "default": false

              },
              "EnforceMaxLevel": {
                "$id": "#/properties/AttributeList/items/anyOf/0/properties/EnforceMaxLevel",
                "type": "boolean",
                "title": "The EnforceMaxLevel schema",
                "description": "An explanation about the purpose of this instance.",
                "default": false

              },
              "Description": {
                "$id": "#/properties/AttributeList/items/anyOf/0/properties/Description",
                "type": "string",
                "title": "The Description schema",
                "description": "An explanation about the purpose of this instance.",
                "default": ""

              },
              "ChildrenList": {
                "$id": "#/properties/AttributeList/items/anyOf/0/properties/ChildrenList",
                "type": "string",
                "title": "The ChildrenList schema",
                "description": "An explanation about the purpose of this instance.",
                "default": ""

              }
            },
            "additionalProperties": true
          }
        ]
      }
    },
    "VariantList": {
      "$id": "#/properties/VariantList",
      "type": "array",
      "title": "The VariantList schema",
      "description": "An explanation about the purpose of this instance.",
      "default": [],

      "additionalItems": true,
      "items": {
        "$id": "#/properties/VariantList/items",
        "anyOf": [
          {
            "$id": "#/properties/VariantList/items/anyOf/0",
            "type": "object",
            "title": "The first anyOf schema",
            "description": "An explanation about the purpose of this instance.",
            "default": {},

            "required": [
              "ID",
              "Name",
              "CostperLevel",
              "AttributeID",
              "Desc",
              "DefaultVariant"
            ],
            "properties": {
              "ID": {
                "$id": "#/properties/VariantList/items/anyOf/0/properties/ID",
                "type": "integer",
                "title": "The ID schema",
                "description": "An explanation about the purpose of this instance.",
                "default": 0

              },
              "Name": {
                "$id": "#/properties/VariantList/items/anyOf/0/properties/Name",
                "type": "string",
                "title": "The Name schema",
                "description": "An explanation about the purpose of this instance.",
                "default": ""

              },
              "CostperLevel": {
                "$id": "#/properties/VariantList/items/anyOf/0/properties/CostperLevel",
                "type": "integer",
                "title": "The CostperLevel schema",
                "description": "An explanation about the purpose of this instance.",
                "default": 0

              },
              "AttributeID": {
                "$id": "#/properties/VariantList/items/anyOf/0/properties/AttributeID",
                "type": "integer",
                "title": "The AttributeID schema",
                "description": "An explanation about the purpose of this instance.",
                "default": 0

              },
              "Desc": {
                "$id": "#/properties/VariantList/items/anyOf/0/properties/Desc",
                "type": "string",
                "title": "The Desc schema",
                "description": "An explanation about the purpose of this instance.",
                "default": ""

              },
              "DefaultVariant": {
                "$id": "#/properties/VariantList/items/anyOf/0/properties/DefaultVariant",
                "type": "boolean",
                "title": "The DefaultVariant schema",
                "description": "An explanation about the purpose of this instance.",
                "default": false

              }
            },
            "additionalProperties": true
          }
        ]
      }
    },
    "TypeList": {
      "$id": "#/properties/TypeList",
      "type": "array",
      "title": "The TypeList schema",
      "description": "An explanation about the purpose of this instance.",
      "default": [],

      "additionalItems": true,
      "items": {
        "$id": "#/properties/TypeList/items",
        "anyOf": [
          {
            "$id": "#/properties/TypeList/items/anyOf/0",
            "type": "object",
            "title": "The first anyOf schema",
            "description": "An explanation about the purpose of this instance.",
            "default": {},

            "required": [
              "ID",
              "Name",
              "TypeOrder"
            ],
            "properties": {
              "ID": {
                "$id": "#/properties/TypeList/items/anyOf/0/properties/ID",
                "type": "integer",
                "title": "The ID schema",
                "description": "An explanation about the purpose of this instance.",
                "default": 0

              },
              "Name": {
                "$id": "#/properties/TypeList/items/anyOf/0/properties/Name",
                "type": "string",
                "title": "The Name schema",
                "description": "An explanation about the purpose of this instance.",
                "default": ""

              },
              "TypeOrder": {
                "$id": "#/properties/TypeList/items/anyOf/0/properties/TypeOrder",
                "type": "integer",
                "title": "The TypeOrder schema",
                "description": "An explanation about the purpose of this instance.",
                "default": 0

              }
            },
            "additionalProperties": true
          }
        ]
      }
    },
    "TemplateName": {
      "$id": "#/properties/TemplateName",
      "type": "string",
      "title": "The TemplateName schema",
      "description": "An explanation about the purpose of this instance.",
      "default": ""

    }
  }
}
